{
  "schema_version": 2,
  "object": "bloom.release",
  "bloom_version": "0.1.0",
  "target": "x86_64-unknown-linux-gnu",
  "embedded_ui": true,
  "self_check": {
    "status": "passed",
    "doctor_status": "warn",
    "failures": 0
  },
  "binaries": [
    {
      "name": "bloom_bench",
      "size_bytes": 12000000,
      "sha256": "1111111111111111111111111111111111111111111111111111111111111111"
    },
    {
      "name": "bloom_desktop",
      "size_bytes": 12000000,
      "sha256": "5555555555555555555555555555555555555555555555555555555555555555"
    },
    {
      "name": "bloom_infer",
      "size_bytes": 18000000,
      "sha256": "2222222222222222222222222222222222222222222222222222222222222222"
    },
    {
      "name": "bloom_server",
      "size_bytes": 22000000,
      "sha256": "3333333333333333333333333333333333333333333333333333333333333333"
    },
    {
      "name": "inspect_gguf",
      "size_bytes": 9000000,
      "sha256": "4444444444444444444444444444444444444444444444444444444444444444"
    }
  ]
}
